checkpoints/natural_resnet18/history.csv

epoch,mode,lr,train_loss,train_acc,val_loss,val_acc
1,natural,0.09972609476841367,2.498037943158831,0.16339285714285715,1.9026952140808104,0.2636000000476837
2,natural,0.09890738003669028,1.7245223229272024,0.34095982142857145,1.6193501516342164,0.3959999997615814
3,natural,0.09755282581475767,1.4760539790562222,0.45417410714285716,1.3280729583740234,0.517399999332428
4,natural,0.09567727288213003,1.274832945551191,0.5330133928571429,1.2595145593643189,0.5484000000953674
5,natural,0.09330127018922194,1.0811610903058733,0.613125,1.1370794746398927,0.6043999994277954
6,natural,0.09045084971874737,0.9286585773740496,0.66890625,1.0183978622436523,0.638999999332428
7,natural,0.0871572412738697,0.8180965290750776,0.7063616071428571,0.8225936589241027,0.7095999994277954
8,natural,0.0834565303179429,0.7216405762944903,0.7463839285714285,0.7632995971679688,0.7400000003814697
9,natural,0.07938926261462365,0.6463068158285958,0.77515625,0.7313036880493164,0.7484000001907348
10,natural,0.07499999999999998,0.5689746425833021,0.80078125,0.6611708287239074,0.7734000005722046
11,natural,0.07033683215379001,0.5156461884294238,0.8202901785714286,0.5875981563568116,0.7965999995231628
12,natural,0.06545084971874737,0.4705503969533103,0.8388616071428572,0.5105573352336884,0.8218000004768372
13,natural,0.06039558454088796,0.42538578237806046,0.8541964285714285,0.5455339877605438,0.8204000002861023
14,natural,0.05522642316338268,0.3853693696430751,0.8667633928571429,0.839698646068573,0.7546000001907348
15,natural,0.05000000000000001,0.3506855551685606,0.8790848214285715,0.4621601158618927,0.8430000002861023
16,natural,0.04477357683661733,0.3300901566232954,0.8858705357142858,0.45986525597572325,0.8449999998092651
17,natural,0.03960441545911203,0.29655352558408465,0.8960267857142857,0.4116868079662323,0.8606000007629394
18,natural,0.03454915028125263,0.2668434017896652,0.9068973214285714,0.42156460881233215,0.8561999994277955
19,natural,0.02966316784621,0.23621467015572956,0.9183928571428571,0.3575012028217316,0.8826000003814697
20,natural,0.025000000000000012,0.21124428706509726,0.9269419642857143,0.32572498383522036,0.8928000004768372
21,natural,0.02061073738537635,0.17865685973848616,0.9367633928571428,0.3077943392276764,0.9022000004768371
22,natural,0.016543469682057107,0.15528805111135754,0.9464955357142857,0.3211037825584412,0.8980000007629394
23,natural,0.012842758726130301,0.1299556287271636,0.9549776785714286,0.33089613840579984,0.9005999999046326
24,natural,0.009549150281252635,0.10814228340983391,0.9633482142857143,0.28452468519210816,0.9140000000953674
25,natural,0.006698729810778067,0.08688359777842249,0.9721428571428572,0.28441841876506807,0.9154000004768371
26,natural,0.004322727117869953,0.07006917274424009,0.9781026785714285,0.2651871176838875,0.922200000667572
27,natural,0.002447174185242324,0.05843512905495507,0.98234375,0.27303594388961794,0.9194000002861022
28,natural,0.0010926199633097158,0.051440625456827024,0.985,0.26878358812332154,0.9228000004768372
29,natural,0.00027390523158633,0.04583262516983918,0.9875,0.265948894238472,0.9250000004768372
30,natural,0.0,0.04228303192981652,0.9880803571428571,0.2642682021856308,0.9242000004768371

EXPERIMENT_STEPS.md

## 5. 训练自然模型

(skq_adv_exp) admin2@admin2-MS-7D25:~/skq/Lesson/DLS/adversarial-attack-and-defense/LessonExp-adversarial-attack-and-defense$ python -m src.train \
>   --mode natural \
>   --data-dir data \
>   --output-dir checkpoints \
>   --run-name natural_resnet18 \
>   --epochs 30 \
>   --batch-size 256 \
>   --lr 0.1 \
>   --amp \
>   --download
100%|████████████████████████████████████████████████████████████████████████████████████████████████████| 170M/170M [00:17<00:00, 9.49MB/s]
/home/admin2/skq/Lesson/DLS/adversarial-attack-and-defense/LessonExp-adversarial-attack-and-defense/src/train.py:152: FutureWarning: `torch.cuda.amp.GradScaler(args...)` is deprecated. Please use `torch.amp.GradScaler('cuda', args...)` instead.
  scaler = GradScaler(enabled=args.amp and device.type == "cuda")
train/natural:   0%|                                                                                                | 0/175 [00:00<?, ?it/s]/home/admin2/skq/Lesson/DLS/adversarial-attack-and-defense/LessonExp-adversarial-attack-and-defense/src/train.py:96: FutureWarning: `torch.cuda.amp.autocast(args...)` is deprecated. Please use `torch.amp.autocast('cuda', args...)` instead.
  with autocast(enabled=args.amp and device.type == "cuda"):
epoch=001 train_loss=2.4980 train_acc=0.1634 val_loss=1.9027 val_acc=0.2636                                                                 
epoch=002 train_loss=1.7245 train_acc=0.3410 val_loss=1.6194 val_acc=0.3960                                                                 
epoch=003 train_loss=1.4761 train_acc=0.4542 val_loss=1.3281 val_acc=0.5174                                                                 
epoch=004 train_loss=1.2748 train_acc=0.5330 val_loss=1.2595 val_acc=0.5484                                                                 
epoch=005 train_loss=1.0812 train_acc=0.6131 val_loss=1.1371 val_acc=0.6044                                                                 
epoch=006 train_loss=0.9287 train_acc=0.6689 val_loss=1.0184 val_acc=0.6390                                                                 
epoch=007 train_loss=0.8181 train_acc=0.7064 val_loss=0.8226 val_acc=0.7096                                                                 
epoch=008 train_loss=0.7216 train_acc=0.7464 val_loss=0.7633 val_acc=0.7400                                                                 
epoch=009 train_loss=0.6463 train_acc=0.7752 val_loss=0.7313 val_acc=0.7484                                                                 
epoch=010 train_loss=0.5690 train_acc=0.8008 val_loss=0.6612 val_acc=0.7734                                                                 
epoch=011 train_loss=0.5156 train_acc=0.8203 val_loss=0.5876 val_acc=0.7966                                                                 
epoch=012 train_loss=0.4706 train_acc=0.8389 val_loss=0.5106 val_acc=0.8218                                                                 
epoch=013 train_loss=0.4254 train_acc=0.8542 val_loss=0.5455 val_acc=0.8204                                                                 
epoch=014 train_loss=0.3854 train_acc=0.8668 val_loss=0.8397 val_acc=0.7546                                                                 
epoch=015 train_loss=0.3507 train_acc=0.8791 val_loss=0.4622 val_acc=0.8430                                                                 
epoch=016 train_loss=0.3301 train_acc=0.8859 val_loss=0.4599 val_acc=0.8450                                                                 
epoch=017 train_loss=0.2966 train_acc=0.8960 val_loss=0.4117 val_acc=0.8606                                                                 
epoch=018 train_loss=0.2668 train_acc=0.9069 val_loss=0.4216 val_acc=0.8562                                                                 
epoch=019 train_loss=0.2362 train_acc=0.9184 val_loss=0.3575 val_acc=0.8826                                                                 
epoch=020 train_loss=0.2112 train_acc=0.9269 val_loss=0.3257 val_acc=0.8928                                                                 
epoch=021 train_loss=0.1787 train_acc=0.9368 val_loss=0.3078 val_acc=0.9022                                                                 
epoch=022 train_loss=0.1553 train_acc=0.9465 val_loss=0.3211 val_acc=0.8980                                                                 
epoch=023 train_loss=0.1300 train_acc=0.9550 val_loss=0.3309 val_acc=0.9006                                                                 
epoch=024 train_loss=0.1081 train_acc=0.9633 val_loss=0.2845 val_acc=0.9140                                                                 
epoch=025 train_loss=0.0869 train_acc=0.9721 val_loss=0.2844 val_acc=0.9154                                                                 
epoch=026 train_loss=0.0701 train_acc=0.9781 val_loss=0.2652 val_acc=0.9222                                                                 
epoch=027 train_loss=0.0584 train_acc=0.9823 val_loss=0.2730 val_acc=0.9194                                                                 
epoch=028 train_loss=0.0514 train_acc=0.9850 val_loss=0.2688 val_acc=0.9228                                                                 
epoch=029 train_loss=0.0458 train_acc=0.9875 val_loss=0.2659 val_acc=0.9250                                                                 
epoch=030 train_loss=0.0423 train_acc=0.9881 val_loss=0.2643 val_acc=0.9242                                                                 
Finished. Best validation accuracy: 0.9250. Run directory: checkpoints/natural_resnet18